2025-08-29-21-14-07|ARTICLE_WRITER|PUBLISHER|gpt-4o-mini|0.5|Building Your First AI Agent: A Step-by-Step Guide...|can_be_posted='no' meets_word_count='no' is_not_sensationalistic='yes' is_correct_language='no'|6|28|1.11
2025-08-29-21-14-11|ARTICLE_WRITER|PUBLISHER|gpt-4o-mini|0.5|Construire votre premier agent IA : Un guide étape par étape...|can_be_posted='no' meets_word_count='no' is_not_sensationalistic='yes' is_correct_language='yes'|6|28|1.08
2025-08-29-21-14-17|ARTICLE_WRITER|PUBLISHER|gpt-4o-mini|0.5|Construire votre premier agent IA : Un guide étape par étape

La création d...|can_be_posted='yes' meets_word_count='yes' is_not_sensationalistic='yes' is_correct_language='yes'|6|28|1.27
2025-08-29-21-14-22|ARTICLE_WRITER|PUBLISHER|gpt-4o-mini|0.5|Why AI Agents Will Replace Traditional Software...|can_be_posted='no' meets_word_count='no' is_not_sensationalistic='yes' is_correct_language='no'|6|28|0.99
2025-08-29-21-14-28|ARTICLE_WRITER|PUBLISHER|gpt-4o-mini|0.5|Pourquoi les agents d'IA remplaceront les logiciels traditionnels...|can_be_posted='no' meets_word_count='no' is_not_sensationalistic='yes' is_correct_language='yes'|6|28|0.93
2025-08-29-21-14-33|ARTICLE_WRITER|PUBLISHER|gpt-4o-mini|0.5|Pourquoi les agents d'IA remplaceront les logiciels traditionnels

L'émerge...|can_be_posted='yes' meets_word_count='yes' is_not_sensationalistic='yes' is_correct_language='yes'|6|28|1.05
